{
  "schema_version": "2.0-rc1",
  "request_id": "sol-w43-selection-r6-readvance-20261025",
  "issue_id": "2026-W43",
  "source_root": "sources/2026-W43",
  "work_branch": "weekly/2026-W43-v2-work",
  "reviewed_main_sha": "041a08dfef3112643cbf85b4a86a7b6f9128aed6",
  "recorded_at": "2026-10-25T11:18:04.266Z",
  "operation": {
    "kind": "ADVANCE_STAGE",
    "expected_from_state": "EVIDENCE_REVIEWED",
    "state_path": "sources/2026-W43/production-state.json",
    "artifacts": [
      {
        "name": "candidate-matrix",
        "path": "sources/2026-W43/candidate-matrix-v2.json"
      },
      {
        "name": "candidate-selection",
        "path": "sources/2026-W43/candidate-selection-v2.json"
      }
    ],
    "agent_reviews": [
      {
        "check_id": "SOL-W43-R6-SELECTION-CONTINUITY-EDITORIAL",
        "kind": "AGENT_EDITORIAL",
        "executor": "J-GAS editorial Sol",
        "evidence": "Editorial read-back after frozen-native pending-Gate invalidation R5-N01/N02/N03. Original complete independent r5 Established Architecture audit: Drive 20261025184803_SolReview.md, Selection PASS_WITH_LIMITATIONS. New r6 32 Matrix/Selection bytes content-equal to archived r5; 19 SELECTED, 1 HOLD, 12 REJECT; 19 uniquely placed, 8 packages, 31 sections, 68/68 Attention. Accepted upstream Evidence and 51-row Materiality unchanged. No Human gate action. Binding Sol review sources/2026-W43/execution/reviews/sol-w43-architecture-r6-postfix-editorial-readback-20261025.md. This is an editorial verification with limitations, not independent raw archival reproduction."
      },
      {
        "check_id": "MUSE-W43-R6-FROZEN-NATIVE-REGENERATION",
        "kind": "AGENT_RESEARCH",
        "executor": "Muse r6 (unchanged frozen runner)",
        "evidence": "Muse executed permitted frozen pending-Gate invalidation to EVIDENCE_REVIEWED (record execution/operator-invalidations/architecture-invalidation-0001.json human_decision=false), then native interactive runner in detached scratch at real state: 19 SELECTED / 8 packages / READY_FOR_ARCHITECTURE_REVIEW. Native Matrix SHA256 16a6bbfe569b3215d05fbae7175b3ca04efc6c1846d28c48662245b68f854c3b and Selection SHA256 50decd8697e1737d7adf6fe9f1ac0f4c7cc891353a7be09461b86e8b90beccea unchanged r3/r4/r5. Stage scratch precheck EVIDENCE_REVIEWED→SELECTION_COMPLETE exit0 PASS without writes, authoritative full Stage to be validated by this Operator. Muse proof sources/2026-W43/execution/reviews/muse-w43-architecture-r6-post-audit-3p2-closure-20261025.md."
      }
    ],
    "summary": "Readvance trusted W43 r6 Selection after genuine frozen operator pending-Gate invalidation: EVIDENCE_REVIEWED→SELECTION_COMPLETE on unchanged 32 Candidate Matrix/Selection (19/1/12); preserve pending Human Architecture/Publication Gates. Architecture to be separately trusted next, only after this Selection receipt/readback PASS."
  }
}
